code,db_code_desc,clean_name
0483T,TMVI W/PROSTHETIC VALVE PERCUTANEOUS APPROACH,
21615,EXCISION 1ST &/CERVICAL RIB,
21627,STERNAL DEBRIDEMENT,
21740,REPAIR PECTUS EXCAVATUM/CARINATUM OPEN,
21743,REPAIR PECTUS EXCAVATM/CARINATM MINLY W/THRSC,
21750,CLOSE MEDIAN STERNOTOMY SEP W/WO DEBRIDEMENT SPX,
32036,THORACOSTOMY OPEN FLAP DRAINAGE EMPYEMA,
32096,THORACTOMY W/DX BX LUNG INFILTRATE UNILATERAL,Thoracotomy
32097,THORACTOMY W/DX BX LUNG NODULE/MASS UNILATERAL,Thoracotomy
32098,THORACOTOMY W/BIOPSY OF PLEURA,Thoracotomy
32100,THORACOTOMY WITH EXPLORATION,Thoracotomy
32110,THORCOM CTRL TRAUMTC HEMRRG&/RPR LNG TEAR,Thoracotomy
32120,THORACOTOMY POSTOPERATIVE COMPLICATIONS,Thoracotomy
32124,THORACOTOMY OPN INTRAPLEURAL PNEUMONOLYSIS,Thoracotomy
32141,THORACOTOMY W/RESECTION BULLAE,Thoracotomy
32150,THORCOM W/RMVL INTRAPLEURAL FB/FIBRIN DEP,Thoracotomy
32160,THORACOTOMY W/CARDIAC MASSAGE,Thoracotomy
32200,PNEUMONOSTOMY W/OPEN DRAINAGE ABSCESS/CYST,
32220,DECORTICATION PULMONARY TOTAL SEPARATE PROCEDURE,Decortication
32225,DECORTICATION PULMONARY PARTIAL SEPARATE PROC,Decortication
32320,DECORTICATION & PARIETAL PLEURECTOMY,Decortication
32440,REMOVAL OF LUNG PNEUMONECTOMY,Pneumonectomy
32445,REMOVAL LUNG PNEUMONECTOMY EXTRAPLEURAL,Pneumonectomy
32480,RMVL LUNG OTHER THAN PNEUMONECTOMY 1 LOBE LOBECT,Partial Lung Removal
32482,RMVL LUNG OTHER THAN PNEUMONECT 2 LOBES BILOBEC,Partial Lung Removal
32484,RMVL LUNG OTHER THAN PNEUMONECT 1 SEGMENTECTOMY,Partial Lung Removal
32486,RMVL LUNG XCP TOT PNEUMONECTOMY SLEEVE LOBECTOMY,Partial Lung Removal
32488,RMVL LUNG OTHER/THAN PNUMEC COMPLETION PNUMEC,Partial Lung Removal
32501,RESCJ&BRONCHOPLASTY PFRMD TM LOBEC/SGMECTOMY,
32505,THORACOTOMY W/THERAPEUTIC WEDGE RESEXN INITIAL,Thoracotomy
32507,THORACOTOMY W/DX WEDGE RESEXN & ANTOM LUNG RESE,Thoracotomy
32540,EXTRAPLEURAL ENUCLEATION EMPYEMA EMPYEMECTOMY,
32601,THORSC DX LUNGS/PERICAR/MED/PLEURAL SPACE W/O BX,Thoracoscopy
32604,THORACOSCOPY DX PERICARDIAL SAC W/BIOPSY SPX,Thoracoscopy
32606,THORACOSCOPY DX MEDIASTINAL SPACE W/BIOPSY SPX,Thoracoscopy
32607,THORACOSCOPY W/DX BX OF LUNG INFILTRATE UNILATRL,Thoracoscopy
32608,THORACOSCOPY W/DX BX OF LUNG NODULES UNILATRL,Thoracoscopy
32609,THORACOSCOPY WITH BIOPSYIES OF PLEURA,Thoracoscopy
32650,THORACOSCOPY W/PLEURODESIS,Thoracoscopy
32651,THORACOSCOPY W/PARTIAL PULMONARY DECORTICATION,Thoracoscopy
32652,THRSC TOT PULM DCRTCTJ INTRAPLEURAL PNEUMONOLSS,Thoracoscopy
32653,THORACOSCOPY RMVL INTRAPLEURAL FB/FIBRIN DEPOSIT,Thoracoscopy
32654,THORACOSCOPY CONTROL TRAUMATIC HEMORRHAGE,Thoracoscopy
32655,THORACOSCOPY W/RESECTION BULLAE W/WO PLEURAL PX,Thoracoscopy
32656,THORACOSCOPY W/PARIETAL PLEURECTOMY,Thoracoscopy
32659,THRSC CRTJ PRCRD WINDOW/PRTL RESCJ PRCRD SAC,Thoracoscopy
32661,THORACOSCOPY W/EXC PERICARDIAL CYST TUMOR/MASS,Thoracoscopy
32662,THORACOSCOPY W/EXC MEDIASTINAL CYST TUMOR/MASS,Thoracoscopy
32663,THORACOSCOPY W/LOBECTOMY SINGLE LOBE,Thoracoscopy
32664,THORACOSCOPY W/THORACIC SYMPATHECTOMY,Thoracoscopy
32665,THORACOSCOPY W/ESOPHAGOMYOTOMY HELLER TYPE,Thoracoscopy
32666,THORACOSCOPY W/THERA WEDGE RESEXN INITIAL UNILAT,Thoracoscopy
32667,THORACOSCOPY W/THERA WEDGE RESEXN ADDL IPSILATRL,Thoracoscopy
32668,THORACOSCOPY W/DX WEDGE RESEXN ANATO LUNG RESEXN,Thoracoscopy
32669,THORACOSCOPY W/SEGMENTECTOMY,Thoracoscopy
32670,THORACOSCOPY W/BILOBECTOMY,Thoracoscopy
32671,THORACOSCOPY W/PNEUMONECTOMY,Thoracoscopy
32672,THORACOSCOPY W/RESEXN-PLICAJ EMPHYSEMA LUNG UNIL,Thoracoscopy
32673,THORACOSCOPY RESEXN THYMUS UNI/BILATERAL,Thoracoscopy
32674,THORCOSCPY W/MEDIASTINL & REGIONL LYMPHDENECTOMY,Thoracoscopy
32800,REPAIR LUNG HERNIA THROUGH CHEST WALL,
32815,OPEN CLOSURE MAJOR BRONCHIAL FISTULA,
32820,MAJOR RECONSTRUCTION CHEST WALL POSTTRAUMATIC,
32851,LUNG TRANSPLANT 1 W/O CARDIOPULMONARY BYPASS,Lung Transplant
32852,LUNG TRANSPLANT 1 W/CARDIOPULMONARY BYPASS,Lung Transplant
32853,LUNG TRANSPLANT 2 W/O CARDIOPULMONARY BYPASS,Lung Transplant
32854,LUNG TRANSPLANT 2 W/CARDIOPULMONARY BYPASS,Lung Transplant
32855,BKBENCH PREPJ CADAVER DONOR LUNG ALLOGRAFT UNI,
32856,BKBENCH PREPJ CADAVER DONOR LUNG ALLOGRAFT BI,
33020,PERICARDIOTOMY REMOVAL CLOT/FOREIGN BODY PRIMARY,
33025,CRTJ PERICARDIAL WINDOW/PRTL RESECJ W/DRG/BX,
33030,PRICARDIECTOMY STOT/COMPL W/O CARDPULM BYPASS,
33031,PRICARDIECTOMY STOT/COMPL W/CARDPULM BYPASS,
33050,RESECTION PERICARDIAL CYST/TUMOR,
33120,EXC INTRACARDIAC TUMOR RESCJ CARDIOPULMONARY BYP,
33140,TRANSMYOCARDIAL LASER REVASCULAR THORACOTOMY SPX,
33141,TRANSMYOCRD LASER REVSC PFRMD TM OTH OPN CAR PX,
33202,INSERTION EPICARDIAL ELECTRODE OPEN,
33203,INSERTION EPICARDIAL ELECTRODE ENDOSCOPIC,
33237,RMVL PRM EPICAR PM&ELTRDS THORCOM DUAL LEAD SY,
33238,RMVL PRM TRANSVENOUS ELECTRODE THORACOTOMY,
33243,RMVL 1/DUAL CHAMBER DEFIB ELECTRODE BY THORACOM,
33254,ABLATION & RECONSTRUCTION ATRIA LIMITED,
33256,ABLATION & RCNSTJ ATRIA EXTNSV W/BYPASS,
33257,ATRIA ABLATE & RCNSTJ W/OTHER PROCEDURE LIMITE,
33259,ATRIA ABLTJ & RCNSTJ W/OTHER PX EXTEN W/BYPASS,
33261,OPRATIVE ABLTJ VENTR ARRHYTHMOGENIC FOC W/BYPASS,
33265,NDSC ABLATION & RCNSTJ ATRIA LIMITED W/O BYPAS,
33300,REPAIR CARDIAC WOUND W/O BYPASS,
33305,REPAIR CARDIAC WOUND W/CARDIOPULMONARY BYPASS,
33310,CARDIOT EXPL W/RMVL FB ATR/VENTR THRMB W/O BYP,
33315,CARDIOT EXPL RMVL FB ATR/VENTR THRMB CARD BYP,
33320,SUTR RPR AORTA/GRT VSL W/O SHUNT/CARD BYP,
33322,SUTURE REPAIR AORTA/GREAT VESSEL W/BYPASS,
33335,INSJ GRAFT AORTA/GREAT VESSEL W/BYPASS,
33361,REPLACE AORTIC VALVE PERQ FEMORAL ARTRY APPROACH,TAVR (perc fem artery approach)
33362,REPLACE AORTIC VALVE OPENFEMORAL ARTERY APPROACH,
33363,REPLACE AORTIC VALVE OPEN AXILLRY ARTRY APPROACH,
33365,REPLACE AORTIC VALVE OPEN TRANSAORTIC APPROACH,
33366,TRANSCATHETER TRANSAPICAL REPLACEMT AORTIC VALVE,
33390,VALVULOPLASTY AORTIC VALVE OPEN CARD BYP SIMPLE,
33391,VALVULOPLASTY AORTIC VALVE OPEN CARD BYP COMPLEX,
33405,RPLCMT PROST AORTIC VALVE OPEN XCP HOMOGRF/STENT,Aortic valve replacement
33411,RPLCMT AORTIC VALVE ANNULUS ENLGMENT NONC SINUS,Aortic valve replacement
33414,RPR VENTR O/F TRC OBSTRCJ PATCH ENLGMENT O/F TRC,
33415,RESECTION/INCISION SUBVALVULAR TISSUE,
33416,VENTRICULOMYOTOMY-MYECTOMY,
33417,AORTOPLASTY SUPRAVALVULAR STENOSIS,
33418,TCAT MITRAL VALVE REPAIR INITIAL PROSTHESIS,TMVR (mitraclip)
33419,TCAT MITRAL VALVE REPAIR ADDL PROSTHESIS,TMVR (mitraclip)
33425,VALVULOPLASTY MITRAL VALVE W/CARDIAC BYPASS,Mitral/Tricuspid valve repair
33426,VLVP MITRAL VALVE W/CARD BYP W/PROSTC RING,Mitral/Tricuspid valve repair
33427,VLVP MITRAL VALVE W/BYPASS RAD RCNSTJ W/WO RING,Mitral/Tricuspid valve repair
33430,REPLACEMENT MITRAL VALVE W/CARDIOPULMONARY BYP,Mitral/Tricuspid valve replacement
33463,VALVULOPLASTY TRICUSPID VALVE W/O RING INSERTION,Mitral/Tricuspid valve repair
33464,VALVULOPLASTY TRICUSPID VALVE W/RING INSERTION,Mitral/Tricuspid valve repair
33465,REPLACEMENT TRICUSPID VALVE W/CARD BYPASS,Mitral/Tricuspid valve replacement
33475,REPLACEMENT PULMONARY VALVE,
33476,R VENTRIC RESCJ INFUND STEN W/WO COMMISSUROTOMY,
33478,OUTFLOW TRACT AGMNTJ W/WO COMMISSUR/INFUND RESCJ,
33496,RPR NON-STRUCT PROSTC VALVE DYSFUNCTION W/BYPASS,
33500,RPR CORONARY AV/ARTERIOCAR CHMBR FSTL W/BYPASS,
33506,RPR ANOM CORONARY ART FROM PULM ART TO AORTA,
33507,RPR ANOM AORTIC ORIGIN CORONARY ART UNROOF/TLCJ,
33508,NDSC SURG W/VIDEO-ASSISTED HARVEST VEIN CABG,
33510,CORONARY ARTERY BYPASS 1 CORONARY VENOUS GRAFT,CABG
33511,CORONARY ARTERY BYPASS 2 CORONARY VENOUS GRAFTS,CABG
33512,CORONARY ARTERY BYPASS 3 CORONARY VENOUS GRAFTS,CABG
33513,CORONARY ARTERY BYPASS 4 CORONARY VENOUS GRAFTS,CABG
33517,CORONARY ARTERY BYP W/VEIN & ARTERY GRAFT 1 VEIN,CABG
33518,CORONARY ARTERY BYP W/VEIN & ARTERY GRAFT 2 VEIN,CABG
33519,CORONARY ARTERY BYP W/VEIN & ARTERY GRAFT 3 VEIN,CABG
33521,CORONARY ARTERY BYP W/VEIN & ARTERY GRAFT 4 VEIN,CABG
33522,CORONARY ARTERY BYP W/VEIN & ARTERY GRAFT 5 VEIN,CABG
33530,ROPRTJ CAB/VALVE PX > 1 MO AFTER ORIGINAL OPERJ,
33533,CABG W/ARTERIAL GRAFT SINGLE ARTERIAL GRAFT,CABG
33534,CABG W/ARTERIAL GRAFT TWO ARTERIAL GRAFTS,CABG
33535,CABG W/ARTERIAL GRAFT THREE ARTERIAL GRAFTS,CABG
33536,CABG W/ARTERIAL GRAFT FOUR/>ARTERIAL GRAFTS,CABG
33542,MYOCARDIAL RESECTION,
33545,RPR POSTINFRCJ VENTRICULAR SEPTAL DEFECT,
33548,SURG VENTRICULAR RSTRJ PX W/PROSTC PATCH PFRMD,
33572,CORONARY ENDARTERCOMY OPEN ANY METHOD,
33641,RPR ATRIAL SEPTAL DFCT SECUNDUM W/BYP W/WO PATCH,
33645,DIR/PTCH CLS SINUS VENOSUS W/WO ANOM PUL VEN DRG,
33647,RPR ATRIAL & VENTRIC SEPTAL DFCT DIR/PATCH CLS,
33681,CLSR 1 VENTRICULAR SEPTAL DEFECT W/WO PATCH,
33702,RPR SINUS VALSALVA FISTULA,
33724,REPAIR ISOLATED PARTIAL PULM VENOUS RETURN,
33860,ASCENDING AORTA GRF W/CARD BYP & VALVE SSP,
33863,AS-AORT GRF W/CARD BYP & AORTIC ROOT RPLCMT,Ascending Aorta graft with aortic root replacement (Bentall)
33864,ASCENDING AORTA GRF VALVE SPARE ROOT REMODEL,Ascending Aorta graft with valve-sparing aortic root remodeling
33870,TRANSVERSE ARCH GRAFT W/CARDIOPULMONARY BYPASS,
33875,DESCENDING THORACIC AORTA GRAFT W/WO BYPASS,Descending Thoracic Aorta graft
33877,RPR THORACOABDOMINAL AORTIC ANEURYS W/WO BYPASS,
33880,EVASC RPR DTA COVERAGE ART ORIGIN 1ST ENDOPROSTH,
33881,EVASC RPR DTA EXP COVERAGE W/O ART ORIGIN,
33910,PULMONARY ARTERY EMBOLECTOMY W/CARD BYPASS,
33916,PULMONARY ENDARTERCOMY W/WO EMBOLECTOMY W/BYPASS,
33917,RPR PULMONARY ART STENOSIS RCNSTJ W/PATCH/GRAFT,
33944,BKBENCH PREPJ CADAVER DONOR HEART ALLOGRAFT,Preparation of donor heart
33945,HEART TRANSPLANT W/WO RECIPIENT CARDIECTOMY,Heart transplant
33952,ECMO/ECLS INSJ OF PRPH CANNULA 6 YRS&OLDER PERQ,
33954,ECMO/ECLS INSJ OF PRPH CANNULA 6 YRS&OLDER OPEN,
33956,ECMO/ECLS INSJ OF CENTRAL CANNULA 6 YRS & OLDER,
33958,ECMO/ECLS REPOS PERPH CANNULA PRQ 6 YRS & OLDER,
33964,ECMO/ECLS ECLS REPOS CENTRAL CNULA 6YRS & OLDER,
33966,ECMO/ECLS RMVL OF PRPH CANNULA PRQ 6 YRS & OLDER,
33975,INSJ VENTRIC ASSIST DEV XTRCORP SINGLE VENTRICLE,LVAD Insertion
33976,INSJ VENTRIC ASSIST DEV XTRCORP BIVENTRICULAR,LVAD Insertion
33977,REMOVAL VENTR ASSIST DEVICE XTRCORP 1 VENTRICLE,LVAD Removal
33978,REMOVAL VENTR ASSIST DEVICE XTRCORP BIVENTR,LVAD Removal
33979,INSJ VENTR ASSIST DEV IMPLTABLE ICORP 1 VNTRC,LVAD Insertion
33980,RMVL VENTR ASSIST DEV IMPLTABLE ICORP 1 VNTRC,LVAD Removal
33981,RPLCMT XTRCORP VAD 1/BIVENTR PUMP 1/EA PUMP,LVAD Replacement of Pump(s)
33983,RPLCMT VAD PMP IMPLTBL ICORP 1 VNTR W/BYPASS,LVAD Replacement of Pump(s)
33984,ECMO/ECLS RMVL PRPH CANNULA OPEN 6 YRS & OLDER,
33986,ECMO/ECLS RMVL OF CENTRAL CANNULA 6 YRS & OLDER,
33987,ARTERY EXPOS/GRAFT ARTERY PERFUSION ECMO/ECLS,
33988,INSERT LEFT HEART VENT BY THORACIC INC ECMO/ECLS,
33989,RMVL LEFT HEART VENT BY THORACIC INCIS ECMO/ECLS,
33990,INSJ PERQ VAD W/IMAGING ARTERY ACCESS ONLY,LVAD Insertion
33992,REMOVAL PERCUTANEOUS VAD DIFFERENT SESSION,LVAD Removal
38746,THORCOM THRC W/MEDSTNL & REGIONAL LMPHADEC,
39010,MEDIAST W/EXPL DRG RMVL FB/BX TTHRC APPR,
39200,RESECTION OF MEDIASTINAL CYST,
39220,RESECTION MEDIASTINAL TUMOR,
39401,MEDIASTINOSCOPY INCLUDES MEDIASTINAL MASS BIOPSY,
39402,MEDIASTINOSCOPY WITH LYMPH NODE BIOPSY/IES,
39541,RPR DIPHRG HRNA OTH/THN NEONATAL TRAUMTC CHRNC,
39545,IMBRICATION DIAPHRAGM EVENTRATION,
39560,RESCJ DIAPHRAGM W/SIMPLE REPAIR,
39561,RESCJ DIAPHRAGM W/COMPLEX REPAIR,
43117,PRTL ESOPHECT DSTL W/WO PROX GASTRECT/PYLORPLSTY,
43235,ESOPHAGOGASTRODUODENOSCOPY TRANSORAL DIAGNOSTIC,
43246,EGD PERCUTANEOUS PLACEMENT GASTROSTOMY TUBE,
43247,EGD FLEXIBLE FOREIGN BODY REMOVAL,
43248,EGD INSERT GUIDE WIRE DILATOR PASSAGE ESOPHAGUS,
43266,EGD ENDOSCOPIC STENT PLACEMENT W/WIRE& DILATION,
60521,THYMECTOMY PRTL/TOT W/O RAD MEDSTNL DSJ SPX,Thymectomy
60522,THYMECTOMY PRTL/TOT RAD MEDSTNL DSJ SPX,Thymectomy
33514,,CABG
33516,,CABG
33523,,CABG
33858,,Ascending Aorta graft disection
33859,,Ascending Aorta graft aneurysm/etc.
33871,,Aortic Arch graft
33991,,LVAD Insertion
33982,,LVAD Replacement of Pump(s)
33364,,Aortic valve procedure
33406,,Aortic valve procedure
33410,,Aortic valve procedure
0345T,,Mitral valve procedure
0484T,,Mitral valve procedure
0543T,,Mitral valve procedure
0544T,,Mitral valve procedure
0545T,,Tricuspid valve procedure
0569T,,Tricuspid valve procedure
0570T,,Tricuspid valve procedure
32035,,Thoracic/Lung procedure
32140,,Thoracic/Lung procedure
32151,,Thoracic/Lung procedure
32215,,Thoracic/Lung procedure
32310,,Thoracic/Lung procedure
32442,,Thoracic/Lung procedure
32491,,Thoracic/Lung procedure
32503,,Thoracic/Lung procedure
32504,,Thoracic/Lung procedure
32658,,Thoracic/Lung procedure
32810,,Thoracic/Lung procedure
32900,,Thoracic/Lung procedure
32905,,Thoracic/Lung procedure
32906,,Thoracic/Lung procedure
39501,,Thoracic/Lung procedure
39540,,Thoracic/Lung procedure
33130,,Thoracic/cardiac procedure
33236,,Thoracic/cardiac procedure
33250,,Thoracic/cardiac procedure
33251,,Thoracic/cardiac procedure
33255,,Thoracic/cardiac procedure
33258,,Thoracic/cardiac procedure
33266,,Thoracic/cardiac procedure
33321,,Thoracic/cardiac procedure
33330,,Thoracic/cardiac procedure
33404,,Thoracic/cardiac procedure
33422,,Thoracic/cardiac procedure
33460,,Thoracic/cardiac procedure
33474,,Thoracic/cardiac procedure
33501,,Thoracic/cardiac procedure
33502,,Thoracic/cardiac procedure
33503,,Thoracic/cardiac procedure
33504,,Thoracic/cardiac procedure
33505,,Thoracic/cardiac procedure
33675,,Thoracic/cardiac procedure
33710,,Thoracic/cardiac procedure
33720,,Thoracic/cardiac procedure
33722,,Thoracic/cardiac procedure
33800,,Thoracic/cardiac procedure
33802,,Thoracic/cardiac procedure
33803,,Thoracic/cardiac procedure
33915,,Thoracic/cardiac procedure
33973,,Thoracic/cardiac procedure
33974,,Thoracic/cardiac procedure
33962,,ECMO
43237,,Common GI procedure
21601,,General thoracic procedure
21602,,General thoracic procedure
21603,,General thoracic procedure
21742,,General thoracic procedure
64804,,General thoracic procedure
64809,,General thoracic procedure
